[
  {
    "id": "card-portfolio-intelligence",
    "meta": {
      "title": "Portfolio Intelligence",
      "tags": [
        "portfolio",
        "analysis"
      ],
      "desc": "AI analysis of portfolio mix and P&L. Publishes structured insights as tokens for downstream risk and action cards."
    },
    "requires": [
      "positions"
    ],
    "source_defs": [
      {
        "bindTo": "analysis",
        "outputFile": "card-concentration-analysis.json",
        "projections": {
          "positions": "requires.positions"
        },
        "copilot": {
          "prompt_template": "You are a concise equity analyst. Use web search to get today's news and upcoming events for each ticker before answering.\n\nPortfolio positions:\n{{positions}}\n\nFields: ticker, quantity, cost_basis ($), price ($), value ($), gain_$ (unrealised P&L), gain_% (unrealised return), chg_$ (today's position P&L $), chg_pct (today's % move).\n\nIMPORTANT OUTPUT RULES:\n- Return ONLY a valid JSON object. No markdown code fences, no preamble, no trailing text.\n- Start your response with { and end with }.\n- No emojis anywhere.\n- Each value is a Markdown string using - bullet points. No sub-headings inside values.\n- Maximum 40 words per section.\n\n{\n  \"mix\": \"- <dominant holding ticker, % of total, and whether that is a risk>\\n- <sector clustering in one line>\",\n  \"pnl\": \"- Best: <ticker> +X% (+$Y)\\n- Worst: <ticker> +X% (+$Y)\",\n  \"risks\": \"- <TICKER>: <one specific current risk with event name or date>\\n- <TICKER>: ...\\n- (one bullet per position from today's news)\",\n  \"action\": \"- <one sentence: specific action and reason grounded in today's market>\"\n}"
        }
      }
    ],
    "compute": [
      {
        "bindTo": "mix",
        "expr": "fetched_sources.analysis.mix"
      },
      {
        "bindTo": "pnl",
        "expr": "fetched_sources.analysis.pnl"
      },
      {
        "bindTo": "risks",
        "expr": "fetched_sources.analysis.risks"
      },
      {
        "bindTo": "action",
        "expr": "fetched_sources.analysis.action"
      }
    ],
    "provides": [
      {
        "bindTo": "portfolio_mix",
        "ref": "computed_values.mix"
      },
      {
        "bindTo": "portfolio_pnl",
        "ref": "computed_values.pnl"
      },
      {
        "bindTo": "portfolio_risks",
        "ref": "computed_values.risks"
      },
      {
        "bindTo": "portfolio_action",
        "ref": "computed_values.action"
      }
    ],
    "view": {
      "elements": [
        {
          "kind": "markdown",
          "label": "Mix",
          "data": {
            "bind": "computed_values.mix"
          }
        },
        {
          "kind": "markdown",
          "label": "P&L",
          "data": {
            "bind": "computed_values.pnl"
          }
        }
      ],
      "layout": {
        "board": {
          "col": 3,
          "order": 4
        },
        "canvas": {
          "x": 1300,
          "y": 50,
          "w": 340,
          "h": 200
        }
      },
      "features": {
        "refresh": true,
        "chat": true
      }
    },
    "card_data": {}
  },
  {
    "id": "card-foundry-brief",
    "meta": {
      "title": "AI Brief",
      "tags": [
        "foundry",
        "ai",
        "live"
      ],
      "desc": "Generates a concise AI brief for any portfolio or market topic using Azure AI Foundry."
    },
    "requires": [],
    "source_defs": [
      {
        "bindTo": "ai_brief",
        "outputFile": "card-foundry-brief.json",
        "projections": {
          "query": "card_data.query"
        },
        "foundry": {
          "prompt_template": "{{query}}\n\nRespond concisely. Plain text or short markdown only, no headers. Max 200 words."
        }
      }
    ],
    "compute": [
      {
        "bindTo": "brief_text",
        "expr": "fetched_sources.ai_brief ? fetched_sources.ai_brief : '_Hit refresh to generate the brief._'"
      }
    ],
    "view": {
      "elements": [
        {
          "kind": "form",
          "label": "Topic",
          "data": {
            "writeTo": "card_data",
            "saveLabel": "Apply",
            "discardLabel": "Reset",
            "fields": {
              "type": "object",
              "properties": {
                "query": {
                  "type": "string",
                  "title": "Question or topic"
                }
              },
              "required": [
                "query"
              ]
            }
          }
        },
        {
          "kind": "markdown",
          "label": "Brief",
          "data": {
            "bind": "computed_values.brief_text"
          }
        }
      ],
      "layout": {
        "board": {
          "col": 6,
          "order": 20
        },
        "canvas": {
          "x": 1200,
          "y": 900,
          "w": 520,
          "h": 380
        }
      },
      "features": {
        "refresh": true
      }
    },
    "card_data": {
      "query": "Give a brief summary of current market themes to watch for an equity portfolio investor."
    }
  },
  {
    "id": "card-market-prices",
    "meta": {
      "title": "Market Prices",
      "tags": [
        "prices",
        "market"
      ],
      "desc": "Fetches live prices for portfolio tickers. Publishes enriched quote data for downstream portfolio value calculations."
    },
    "requires": [
      "holdings"
    ],
    "source_defs": [
      {
        "bindTo": "quotes",
        "outputFile": "market-prices-quotes.json",
        "projections": {
          "quote_urls": "requires.holdings.ticker.('https://query1.finance.yahoo.com/v8/finance/chart/' & $ & '?interval=1d&range=1d')"
        },
        "urls": {
          "url": "{{url}}",
          "projectionList": "quote_urls",
          "headers": {
            "User-Agent": "Mozilla/5.0 (compatible; portfolio-tracker-demo/1.0)"
          },
          "cacheTimeout": 3600
        }
      }
    ],
    "compute": [
      {
        "bindTo": "normalizedQuotes",
        "expr": "($raw := fetched_sources.quotes; $rows := $type($raw) = 'array' ? $raw : (($exists($raw.resultValue) and $type($raw.resultValue) = 'array') ? $raw.resultValue : [$raw]); $normalized := $filter($map($rows, function($row) { ($level1 := $exists($row.resultValue) ? $row.resultValue : $row; $level2 := $exists($level1.resultValue) ? $level1.resultValue : $level1; $meta := $level2.chart.result[0].meta; $exists($meta.symbol) ? { \"symbol\": $meta.symbol, \"shortName\": ($exists($meta.longName) ? $meta.longName : $meta.shortName), \"regularMarketPrice\": $meta.regularMarketPrice, \"regularMarketChange\": ($exists($meta.regularMarketChange) ? $meta.regularMarketChange : (($exists($meta.chartPreviousClose) and $exists($meta.regularMarketPrice)) ? ($meta.regularMarketPrice - $meta.chartPreviousClose) : null)), \"regularMarketChangePercent\": ($exists($meta.regularMarketChangePercent) ? $meta.regularMarketChangePercent : (($exists($meta.chartPreviousClose) and $meta.chartPreviousClose != 0 and $exists($meta.regularMarketPrice)) ? (($meta.regularMarketPrice - $meta.chartPreviousClose) / $meta.chartPreviousClose * 100) : null)) } : undefined) }), function($q) { $exists($q.symbol) }); { \"quoteResponse\": { \"result\": $normalized, \"error\": null } })"
      },
      {
        "bindTo": "prices",
        "expr": "$map(computed_values.normalizedQuotes.quoteResponse.result, function($q) { {\"ticker\": $q.symbol, \"name\": $q.shortName, \"price\": ($exists($q.regularMarketPrice) ? $round($q.regularMarketPrice, 2) : null), \"change\": ($exists($q.regularMarketChange) ? $round($q.regularMarketChange, 2) : null), \"chg_pct\": ($exists($q.regularMarketChangePercent) ? $round($q.regularMarketChangePercent, 2) : null)} })"
      }
    ],
    "provides": [
      {
        "bindTo": "quotes",
        "ref": "computed_values.normalizedQuotes"
      }
    ],
    "view": {
      "elements": [
        {
          "kind": "table",
          "label": "Prices",
          "data": {
            "bind": "computed_values.prices",
            "columns": [
              "ticker",
              "name",
              "price",
              "change",
              "chg_pct"
            ],
            "sortable": true
          }
        }
      ],
      "layout": {
        "board": {
          "col": 4,
          "order": 2
        },
        "canvas": {
          "x": 400,
          "y": 50,
          "w": 400,
          "h": 340
        }
      },
      "features": {
        "refresh": true
      }
    },
    "card_data": {}
  },
  {
    "id": "card-my-identity",
    "meta": {
      "title": "My Identity",
      "tags": [
        "m365",
        "workiq"
      ],
      "desc": "Displays your M365 display name via WorkIQ (Microsoft 365 Copilot)."
    },
    "source_defs": [
      {
        "bindTo": "identity",
        "outputFile": "card-my-identity.txt",
        "mcp": {
          "server": "workiq",
          "tool": "workiq.ask",
          "input": {
            "query": "what is my full display name. No Fluff. No Commentary. No Descriptions. Just Answer the Question"
          }
        }
      },
      {
        "bindTo": "manager",
        "outputFile": "card-my-identity-manager.txt",
        "mcp": {
          "server": "workiq",
          "tool": "workiq.ask",
          "input": {
            "query": "who is my manager. No Fluff. No Commentary. No Descriptions. Just Answer with the name"
          }
        }
      }
    ],
    "compute": [
      {
        "bindTo": "identity",
        "expr": "fetched_sources.identity"
      },
      {
        "bindTo": "managerLine",
        "expr": "'**Manager:** ' & fetched_sources.manager"
      }
    ],
    "view": {
      "elements": [
        {
          "kind": "markdown",
          "data": {
            "bind": "computed_values.identity"
          }
        },
        {
          "kind": "markdown",
          "data": {
            "bind": "computed_values.managerLine"